code,name,descr,lang_code,is_active,cr_by,cr_dtimes
FNR,Fingerprint,Finger prints of the applicant,eng,t,superadmin,2020-12-23 14:36:46.332105
IRS,Iris,Iris of the applicant,eng,t,superadmin,2020-12-23 14:36:46.332105
PHT,Photo,Photo of the face of the applicant,eng,t,superadmin,2020-12-23 14:36:46.332105
FNR,የጣት አሻራ,የአመልካች የጣት አሻራ,amh,t,superadmin,2020-12-23 14:36:46.332105
IRS,የአይን ብሌን, የአመልካች የአይን ብሌን,amh,t,superadmin,2020-12-23 14:36:46.332105
PHT,ፎቶ, የአመልካች ፎቶ,amh,t,superadmin,2020-12-23 14:36:46.332105
